{
  "documentType": "ium5-gate-b-technical-evidence",
  "schemaVersion": 1,
  "protocolId": "IUM5-GATE-B-1",
  "evidenceId": "GB-TECH-SYNTHETIC-01",
  "module": {
    "id": "IUM-5-CORE-05",
    "version": "0.1.0",
    "status": "working",
    "deviceVerified": "not-run"
  },
  "build": {
    "buildRevision": "1111111111111111111111111111111111111111",
    "previewId": "ium5-gate-b-synthetic-001",
    "publicationMode": "gate-b-preview"
  },
  "policySummary": "documented",
  "rows": [
    {
      "id": "TECH-IPAD-TOUCH",
      "operatingSystem": {
        "family": "linux",
        "version": "1"
      },
      "browser": {
        "family": "chromium",
        "version": "1"
      },
      "managedStatus": "not-managed",
      "policyStatus": "documented",
      "networkContext": "school-network",
      "checks": [
        {
          "id": "startup",
          "result": "pass"
        }
      ],
      "result": "pass",
      "findings": [],
      "privateEvidenceRef": "EVID-TECH-IPAD-TOUCH"
    },
    {
      "id": "TECH-IPAD-VO",
      "operatingSystem": {
        "family": "linux",
        "version": "1"
      },
      "browser": {
        "family": "chromium",
        "version": "1"
      },
      "managedStatus": "not-managed",
      "policyStatus": "documented",
      "networkContext": "school-network",
      "checks": [
        {
          "id": "startup",
          "result": "pass"
        }
      ],
      "result": "pass",
      "findings": [],
      "privateEvidenceRef": "EVID-TECH-IPAD-VO"
    },
    {
      "id": "TECH-DESKTOP-CHROMIUM",
      "operatingSystem": {
        "family": "linux",
        "version": "1"
      },
      "browser": {
        "family": "chromium",
        "version": "1"
      },
      "managedStatus": "not-managed",
      "policyStatus": "documented",
      "networkContext": "school-network",
      "checks": [
        {
          "id": "startup",
          "result": "pass"
        }
      ],
      "result": "pass",
      "findings": [],
      "privateEvidenceRef": "EVID-TECH-DESKTOP-CHROMIUM"
    },
    {
      "id": "TECH-DESKTOP-FIREFOX",
      "operatingSystem": {
        "family": "linux",
        "version": "1"
      },
      "browser": {
        "family": "chromium",
        "version": "1"
      },
      "managedStatus": "not-managed",
      "policyStatus": "documented",
      "networkContext": "school-network",
      "checks": [
        {
          "id": "startup",
          "result": "pass"
        }
      ],
      "result": "pass",
      "findings": [],
      "privateEvidenceRef": "EVID-TECH-DESKTOP-FIREFOX"
    },
    {
      "id": "TECH-NET-OFFLINE-UPDATE",
      "operatingSystem": {
        "family": "linux",
        "version": "1"
      },
      "browser": {
        "family": "chromium",
        "version": "1"
      },
      "managedStatus": "not-managed",
      "policyStatus": "documented",
      "networkContext": "school-network",
      "checks": [
        {
          "id": "startup",
          "result": "pass"
        }
      ],
      "result": "pass",
      "findings": [],
      "privateEvidenceRef": "EVID-TECH-NET-OFFLINE-UPDATE"
    },
    {
      "id": "TECH-LMS-ROUTE",
      "operatingSystem": {
        "family": "linux",
        "version": "1"
      },
      "browser": {
        "family": "chromium",
        "version": "1"
      },
      "managedStatus": "not-managed",
      "policyStatus": "documented",
      "networkContext": "school-network",
      "checks": [
        {
          "id": "startup",
          "result": "pass"
        }
      ],
      "result": "pass",
      "findings": [],
      "privateEvidenceRef": "EVID-TECH-LMS-ROUTE"
    }
  ],
  "limitedException": null,
  "privacy": {
    "unexpectedThirdPartyRequests": false,
    "prohibitedDataObserved": false,
    "telemetryObserved": false
  },
  "result": "pass",
  "retentionClass": "outside-repository-until-decision-plus-30-days"
}
